{
  "schema_version": "layout_plan_v1",
  "renderer": { "name": "pptx_renderer", "version": "1.0.0" },
  "deck": {
    "slide_size": "widescreen_16_9",
    "width_in": 13.333,
    "height_in": 7.5,
    "safe_area_in": { "x": 0.5, "y": 0.5, "w": 12.333, "h": 6.6 },
    "footer_band_in": { "x": 0.5, "y": 7.1, "w": 12.333, "h": 0.4 }
  },
  "theme": {
    "template_id": "tpl_default",
    "brand_kit_id": "bk_acme",
    "fonts": { "heading": "Pretendard", "body": "Pretendard" },
    "min_font_pt": { "heading": 20, "body": 12 }
  },
  "slides": [
    {
      "slide_id": "s1",
      "layout_id": "title_center",
      "placeholders": [
        { "name": "TITLE", "bbox_in": { "x": 1.0, "y": 2.1, "w": 11.3, "h": 1.2 } }
      ],
      "elements": [
        {
          "element_id": "s1_e1",
          "kind": "text",
          "role": "title",
          "source_ref": { "path": "deck.slides[0].elements[0]" },
          "resolved_style": {
            "font_family": "Pretendard",
            "font_pt": 36,
            "line_height_pt": 46,
            "bold": true,
            "italic": false,
            "color_hex": "#111111"
          },
          "layout": {
            "bbox_in": { "x": 1.0, "y": 2.1, "w": 11.3, "h": 1.2 },
            "z_index": 20,
            "align": "center",
            "valign": "middle"
          },
          "text_metrics": {
            "text_length": 18,
            "wrap_mode": "word",
            "lines": [{ "text": "2026 Business Plan", "width_in": 5.4, "height_in": 0.45 }],
            "required_height_in": 0.55,
            "box_height_in": 1.2,
            "overflow": { "is_overflow": false, "ratio": 0.0 }
          }
        }
      ],
      "diagnostics": { "overlaps": [], "out_of_bounds": [] }
    }
  ],
  "summary": {
    "slide_count": 1,
    "issue_counts": { "overflow": 0, "overlap": 0, "out_of_bounds": 0, "min_font": 0 },
    "generated_at": "2026-01-21T12:00:00Z"
  }
}
